<?xml version="1.0" encoding="UTF-8"?>
<Command xmlns:xsi="http://www.w3.org/2001/XMLSchema-instance" xsi:noNamespaceSchemaLocation="VoidTicketAnswer.xsd">
	<Header>
		<ReferenceNumber> 12345678</ReferenceNumber>
		<RequestNumber>7654321</RequestNumber>
		<SessionId>7777777</SessionId>
		<RequestType>Void</RequestType>
		<RequestSubType>VoidTicket</RequestSubType>
		<ValueMsg>
			<ValuedQty>10</ValuedQty>
			<NonValuedQty>0</NonValuedQty>
		</ValueMsg>
	</Header>
	<VoidTicket>
		<Error>
			<ErrorCode>21</ErrorCode>
			<ErrorShortDescription>OP_FAIL_CC_PAYM_NOT_APP</ErrorShortDescription>
			<ErrorDescription>CREDIT CARD PAYMENT NOT APPROVED</ErrorDescription>
		</Error>
		<TicketInfoVoid>
			<Item>1</Item>
			<ItemStatus>0</ItemStatus>
			<TicketType>25834</TicketType>
			<Price>239.63</Price>
			<Tax>14.63</Tax>
			<RemainingValue>350.48</RemainingValue>
			<VoidCode>0</VoidCode>
			<Ticket>
				<TDSSN>
					<Site>WDW</Site>
					<Station>CAS999</Station>
					<Date>09-06-15</Date>
					<TicketId>303</TicketId>
				</TDSSN>
				<TCOD>99999999999999999</TCOD>
				<BarCode>77777777777777777777</BarCode>
				<MagCode> FFFFFFFFFFFFFFFFFFFFFFFF </MagCode>
				<ExternalTicketCode>ABCDEFGHIJKLMNOPQRSTUVWXYZ</ExternalTicketCode>
			</Ticket>
			<LastUsageDate>30-12-31</LastUsageDate>
			<TaxExempt>0</TaxExempt>
		</TicketInfoVoid>
		<PaymentInfo>
			<Item>1</Item>
			<PaymentType>2</PaymentType>
			<PaymentAmount>835.24</PaymentAmount>
			<CreditCard>
				<CardType>0</CardType>
				<AuthErrorCode>0</AuthErrorCode>
				<AuthNumber>09997Z    </AuthNumber>
				<AuthMessage>APPROVED            </AuthMessage>
				<CCNumber>XXXXXXXXXXXX1234</CCNumber>
				<RRN>666666666666</RRN>
			</CreditCard>
		</PaymentInfo>
		<PaymentInfo>
			<Item>2</Item>
			<PaymentType>6</PaymentType>
			<PaymentAmount>835.24</PaymentAmount>
			<Voucher>
				<MasterCode>4444</MasterCode>
				<UniqueCode>1234</UniqueCode>
			</Voucher>
		</PaymentInfo>
		<TransactionDSSN>
			<Site>WDW</Site>
			<Station>CAS999</Station>
			<Date>09-06-15</Date>
			<TransactionId>123</TransactionId>
		</TransactionDSSN>
		<TransactionCOD>99999999999999999</TransactionCOD>
	</VoidTicket>
</Command>
